{"answer":"근거 부족. NLI 검증 모델을 사용할 수 없음 — `[rag] nli_threshold = 0` 으로 비활성화 후 재시도 가능.","citations":[],"created_at":"2026-05-26T01:26:45.887132823Z","embedding":{"dimensions":384,"id":"multilingual-e5-small","provider":"fastembed"},"grounded":false,"hops":[{"context_chunks_added":0,"forced_stop":false,"iter":0,"kind":"decompose","llm_call_ms":37987,"sub_queries":["Kebab의 목적은 무엇인가?","Kebab은 multilingual-e5와 어떻게 통합되는가?","Kebab은 LanceDB와 어떻게 통합되는가?","Kebab은 RRF와 어떻게 통합되는가?","Kebab의 통합의 이유는 무엇인가?"]},{"context_chunks_added":15,"forced_stop":true,"iter":1,"kind":"decide","llm_call_ms":0,"sub_queries":[]}],"model":{"dimensions":null,"id":"gemma3:4b","provider":"ollama"},"prompt_template_version":"rag-multi-hop-v1","refusal_reason":"nli_model_unavailable","retrieval":{"chunks_returned":0,"chunks_used":0,"k":10,"mode":"hybrid","score_gate":0.30000001192092896,"top_score":0.0,"trace_id":"ret_d10dd875"},"schema_version":"answer.v1","usage":{"completion_tokens":0,"latency_ms":311799,"prompt_tokens":0}}
