{"answer":"근거 부족. 생성된 답변이 검색된 문서 내용에 충분히 entail 되지 않음.","citations":[],"created_at":"2026-05-26T01:16:38.053607085Z","embedding":{"dimensions":384,"id":"multilingual-e5-small","provider":"fastembed"},"grounded":false,"hops":[{"context_chunks_added":0,"forced_stop":false,"iter":0,"kind":"decompose","llm_call_ms":55425,"sub_queries":["What is the chemical formula of caffeine?","Caffeine chemical formula"]},{"context_chunks_added":14,"forced_stop":false,"iter":1,"kind":"decide","llm_call_ms":41352,"sub_queries":["What is the chemical formula of caffeine?","What is the molecular structure of caffeine?","What are the functional groups present in caffeine?","What is the IUPAC name of caffeine?","What are the isomers of caffeine?"]},{"context_chunks_added":1,"forced_stop":true,"iter":2,"kind":"decide","llm_call_ms":0,"sub_queries":[]}],"model":{"dimensions":null,"id":"gemma3:4b","provider":"ollama"},"prompt_template_version":"rag-multi-hop-v1","refusal_reason":"nli_verification_failed","retrieval":{"chunks_returned":0,"chunks_used":0,"k":10,"mode":"hybrid","score_gate":0.30000001192092896,"top_score":0.0,"trace_id":"ret_a1b48d22"},"schema_version":"answer.v1","usage":{"completion_tokens":0,"latency_ms":240649,"prompt_tokens":0},"verification":{"nli_passed":false,"nli_score":0.0035389824770390987,"nli_threshold":0.5}}
