{"answer":"근거 부족. 생성된 답변이 검색된 문서 내용에 충분히 entail 되지 않음.","citations":[],"created_at":"2026-05-26T01:20:48.044449683Z","embedding":{"dimensions":384,"id":"multilingual-e5-small","provider":"fastembed"},"grounded":false,"hops":[{"context_chunks_added":0,"forced_stop":false,"iter":0,"kind":"decompose","llm_call_ms":70908,"sub_queries":["컴파일러의 lexer가 parser에 전달하는 데이터는 무엇인가?","컴파일러의 parser가 type checker에 전달하는 데이터는 무엇인가?","lexer-parser 파이프라인의 출력 데이터는 type checker에 어떻게 사용되는가?","컴파일러 파이프라인에서 각 단계의 출력 데이터 형식은 무엇인가?","lexer-parser-typechecker 파이프라인의 데이터 의존성 흐름은 무엇인가?"]},{"context_chunks_added":15,"forced_stop":true,"iter":1,"kind":"decide","llm_call_ms":0,"sub_queries":[]}],"model":{"dimensions":null,"id":"gemma3:4b","provider":"ollama"},"prompt_template_version":"rag-multi-hop-v1","refusal_reason":"nli_verification_failed","retrieval":{"chunks_returned":0,"chunks_used":0,"k":10,"mode":"hybrid","score_gate":0.30000001192092896,"top_score":0.0,"trace_id":"ret_e5f08b72"},"schema_version":"answer.v1","usage":{"completion_tokens":0,"latency_ms":224087,"prompt_tokens":0},"verification":{"nli_passed":false,"nli_score":0.058334656059741974,"nli_threshold":0.5}}
